{
  "as_of": "2026-09-22",
  "dashboard_summary": {
    "canary_check_count": 101,
    "canary_claim_count": 79,
    "required_canary_gap_count": 0
  },
  "drift": {
    "evidence_drift": [],
    "lifecycle_drift": [],
    "metadata": [],
    "proof_drift": [],
    "role_drift": [],
    "tag_drift": []
  },
  "drift_detected": false,
  "generated_from": [
    "tests/runtime/node/compat/node-lts-compat/node-lts-lanes.json",
    "tests/runtime/node/compat/node-lts-compat/node-latest-suite-tags.json",
    "tests/runtime/node/compat/node-compat-evidence/latest/status-summary.json",
    "tests/runtime/node/compat/node-compat-evidence/latest/dashboard-summary.json"
  ],
  "lane_contracts": [
    {
      "dashboard_lane_role": "legacy",
      "evidence_policy": "legacy_grace_regression_only",
      "fixture_corpus_current_tag": "v20.20.2",
      "fixture_sync_required": false,
      "lane": "node20",
      "latest_official_tag": "v20.20.2",
      "major": 20,
      "product_default": false,
      "release_train_role": "legacy_grace",
      "runtime_compatibility_target": "Node20",
      "support_phase": "eol_legacy",
      "upstream_tag": "v20.20.2"
    },
    {
      "dashboard_lane_role": "supported",
      "evidence_policy": "supported_lts_lane_local_evidence",
      "fixture_corpus_current_tag": "v22.23.2",
      "fixture_sync_required": false,
      "lane": "node22",
      "latest_official_tag": "v22.23.2",
      "major": 22,
      "product_default": false,
      "release_train_role": "supported_lts",
      "runtime_compatibility_target": "Node22",
      "support_phase": "maintenance_lts",
      "upstream_tag": "v22.23.2"
    },
    {
      "dashboard_lane_role": "default",
      "evidence_policy": "supported_lts_lane_local_evidence",
      "fixture_corpus_current_tag": "v24.21.0",
      "fixture_sync_required": false,
      "lane": "node24",
      "latest_official_tag": "v24.21.0",
      "major": 24,
      "product_default": true,
      "release_train_role": "product_default",
      "runtime_compatibility_target": "Node24",
      "support_phase": "active_lts",
      "upstream_tag": "v24.21.0"
    },
    {
      "dashboard_lane_role": "current",
      "evidence_policy": "current_non_lts_lane_local_evidence_until_lts_promotion",
      "fixture_corpus_current_tag": "v26.10.0",
      "fixture_sync_required": false,
      "lane": "node26",
      "latest_official_tag": "v26.10.0",
      "major": 26,
      "product_default": false,
      "release_train_role": "current_non_lts",
      "runtime_compatibility_target": "Node26",
      "support_phase": "current_non_lts",
      "upstream_tag": "v26.10.0"
    }
  ],
  "live_probe": {
    "dist_index_checked": false,
    "schedule_checked": false
  },
  "proof_gate": {
    "missing_digest_markers": [],
    "proof_artifact": "tests/runtime/node/compat/provenance/nfrc11-release-train-automation.md",
    "proof_file_present": true,
    "proof_readme": "tests/runtime/node/compat/provenance/README.md",
    "proof_readme_lists_artifact": true,
    "required_digest_markers": [
      "tests/runtime/node/compat/node-lts-compat/node-lts-lanes.json sha256: 74d6e560865153183b2b46ffed8396ed4722e75531c12b6bdfd2e190194610dd",
      "tests/runtime/node/compat/node-lts-compat/node-latest-suite-tags.json sha256: 243a9686bfc38a26e673286f9f7cad4165171de87645148a24470165783675ee"
    ]
  },
  "report_kind": "nimbus_node_release_train",
  "schema_version": 1,
  "source_digests": [
    {
      "path": "tests/runtime/node/compat/node-lts-compat/node-lts-lanes.json",
      "sha256": "74d6e560865153183b2b46ffed8396ed4722e75531c12b6bdfd2e190194610dd"
    },
    {
      "path": "tests/runtime/node/compat/node-lts-compat/node-latest-suite-tags.json",
      "sha256": "243a9686bfc38a26e673286f9f7cad4165171de87645148a24470165783675ee"
    },
    {
      "path": "tests/runtime/node/compat/node-compat-evidence/latest/status-summary.json",
      "sha256": "989f86e032860d1ed7db9f738f9ab255dc853f5fff2858f268b538b4c7bcbb6f"
    },
    {
      "path": "tests/runtime/node/compat/node-compat-evidence/latest/dashboard-summary.json",
      "sha256": "7761c45d2c72f629de21478afb5926e4258dd430644564b92591d89c2264c7cd"
    }
  ],
  "source_urls": [
    "https://nodejs.org/dist/index.json",
    "https://raw.githubusercontent.com/nodejs/Release/main/schedule.json"
  ]
}
